MCQ,Choices,Correct
Who coined the term machine learning in 1959?,a: Donald Hebb | b: Raytheon Company | c: Arthur Samuel | d: Tom M. Mitchell,c
What was the earliest machine learning program introduced by Arthur Samuel in the 1950s?,a: Stock trading algorithm | b: Computer vision program | c: Checkers winning chance calculator | d: Speech pattern analyzer,c
Which book introduced a theoretical neural structure by Donald Hebb in 1949?,a: The Organization of Behavior | b: Learning Machines | c: Computing Machinery and Intelligence | d: The History of Machine Learning,a
What is the purpose of modern-day machine learning algorithms?,a: To classify data and make predictions | b: To play computer games | c: To create artificial intelligence | d: To study human cognitive processes,a
"According to Tom M. Mitchell, what defines a computer program learning from experience?",a: Improvement in performance with experience E | b: Ability to think like humans | c: Recognition of patterns in data | d: Use of reinforcement learning,a
